{
  "$schema": "https://json-schema.org/draft/2020-12/schema",
  "$id": "https://raw.githubusercontent.com/codeactual/evolve/main/schemas/evaluation.schema.json",
  "title": "evolve EVALUATION rollup (schema 3)",
  "description": "The machine-readable rollup emitted beside EVALUATION.md (EVALUATION.<ext>; format selected by results_format), aggregating every plugin's stored results per model and per skill, with deltas vs the previous run and the without-skill baseline.",
  "type": "object",
  "required": ["schema", "tool_version", "plugins"],
  "properties": {
    "$schema": { "type": "string" },
    "schema": { "const": 3 },
    "tool_version": { "type": "string" },
    "latest_run": { "type": "string", "format": "date-time" },
    "plugins": {
      "type": "object",
      "additionalProperties": { "$ref": "#/$defs/pluginSummary" }
    }
  },
  "additionalProperties": true,
  "$defs": {
    "pluginSummary": {
      "type": "object",
      "properties": {
        "triggers": {
          "allOf": [{ "$ref": "common.schema.json#/$defs/modelKeyMap" }],
          "additionalProperties": { "$ref": "#/$defs/rollup" }
        },
        "evals": {
          "allOf": [{ "$ref": "common.schema.json#/$defs/modelKeyMap" }],
          "additionalProperties": { "$ref": "#/$defs/rollup" }
        },
        "skills": {
          "description": "Per-skill model rollups (model within skill), keyed by skill name.",
          "type": "object",
          "additionalProperties": { "$ref": "#/$defs/skillSummary" }
        }
      },
      "additionalProperties": true
    },
    "skillSummary": {
      "type": "object",
      "properties": {
        "triggers": {
          "allOf": [{ "$ref": "common.schema.json#/$defs/modelKeyMap" }],
          "additionalProperties": { "$ref": "#/$defs/rollup" }
        },
        "evals": {
          "allOf": [{ "$ref": "common.schema.json#/$defs/modelKeyMap" }],
          "additionalProperties": { "$ref": "#/$defs/rollup" }
        }
      },
      "additionalProperties": true
    },
    "rollup": {
      "type": "object",
      "required": ["provider", "display", "total"],
      "properties": {
        "provider": { "type": "string" },
        "display": { "type": "string" },
        "passed": { "type": "integer", "minimum": 0 },
        "failed": { "type": "integer", "minimum": 0 },
        "errored": { "type": "integer", "minimum": 0 },
        "total": { "type": "integer", "minimum": 0 },
        "pass_rate": { "type": "number", "minimum": 0, "maximum": 1 },
        "avg_run_seconds": { "type": "number", "minimum": 0 },
        "estimate": { "$ref": "common.schema.json#/$defs/estimate" },
        "measured": { "$ref": "common.schema.json#/$defs/measured" },
        "baseline": { "$ref": "#/$defs/rollupStats" },
        "previous_delta": { "$ref": "#/$defs/delta" },
        "baseline_delta": { "$ref": "#/$defs/delta" }
      },
      "additionalProperties": true
    },
    "rollupStats": {
      "description": "Bare aggregate figures of a prior run (a without-skill baseline), without model identity or deltas.",
      "type": "object",
      "required": ["total"],
      "properties": {
        "passed": { "type": "integer", "minimum": 0 },
        "failed": { "type": "integer", "minimum": 0 },
        "errored": { "type": "integer", "minimum": 0 },
        "total": { "type": "integer", "minimum": 0 },
        "pass_rate": { "type": "number", "minimum": 0, "maximum": 1 },
        "avg_run_seconds": { "type": "number", "minimum": 0 },
        "estimate": { "$ref": "common.schema.json#/$defs/estimate" },
        "measured": { "$ref": "common.schema.json#/$defs/measured" }
      },
      "additionalProperties": true
    },
    "delta": {
      "description": "Signed change of one metric set between two runs (current minus prior). Each field is present only when both runs measured it; a rising rate is an improvement, while rising cost, tokens, or run time are regressions.",
      "type": "object",
      "properties": {
        "rate": { "type": "number" },
        "avg_run_seconds": { "type": "number" },
        "input_tokens": { "type": "integer" },
        "output_tokens": { "type": "integer" },
        "cost_usd": { "type": "number" }
      },
      "additionalProperties": true
    }
  }
}
